<?xml version="1.0" encoding="UTF-8"?><!--Arbortext, Inc., 1988-2010, v.4002-->
<!DOCTYPE TOPS PUBLIC "-//Justice Canada//DTD TOPS//EN" "TOPS.dtd">
<TOPS xml:lang="en">
    <Statute FlicsAlpha="FlicsAlphaID">
        <Title>Title of Act</Title>
        <ChapterNumber>ChapterNumber</ChapterNumber>
        <OtherLangTitle>Other Language Title</OtherLangTitle>
        <Minister>
            <Text>Minister</Text>
        </Minister>
        <LongTitle>
            <Label>Long Title</Label>
            <Text>Text</Text>
        </LongTitle>
        <Section>
            <Label>2</Label>
            <Text>Text</Text>
        </Section>
        <CIF>
            <Text>CIF Text</Text>
        </CIF>
    </Statute>
</TOPS>