<?xml version="1.0" encoding="UTF-8"?><!--Arbortext, Inc., 1988-2010, v.4002-->
<!DOCTYPE TOPS PUBLIC "-//Justice Canada//DTD TOPS//EN" "TOPS.dtd">
<TOPS xml:lang="fr">
    <Statute FlicsAlpha="FlicsAlphaID">
        <Title>Titre</Title>
        <ChapterNumber>Numéro de chapitre</ChapterNumber>
        <OtherLangTitle>Autre langue Titre</OtherLangTitle>
        <Minister>
            <Text>Ministre</Text>
        </Minister>
        <LongTitle>
            <Label>Titre intégral</Label>
            <Text>Texte</Text>
        </LongTitle>
        <Section>
            <Label>2</Label>
            <Text>Texte</Text>
        </Section>
        <CIF>
            <Text>Texte CIF</Text>
        </CIF>
    </Statute>
</TOPS>